{
  "cols": 20,
  "rows": 6,
  "ok": true,
  "focus": "tz",
  "errors": [],
  "nodes": [
    {
      "id": "main",
      "tag": "screen",
      "x": 0,
      "y": 0,
      "w": 20,
      "h": 6
    },
    {
      "id": "tz",
      "tag": "select",
      "x": 0,
      "y": 0,
      "w": 20,
      "h": 1,
      "text": "Lisbon",
      "focused": true
    },
    {
      "id": "c",
      "tag": "checkbox",
      "x": 0,
      "y": 1,
      "w": 20,
      "h": 1,
      "text": "C"
    }
  ],
  "grid": [
    "Lisbon             ▾",
    "[ ] C               ",
    "                    ",
    "                    ",
    "                    ",
    "                    "
  ]
}
