{
  "cols": 20,
  "rows": 3,
  "ok": true,
  "focus": "dark",
  "errors": [],
  "nodes": [
    {
      "id": "main",
      "tag": "screen",
      "x": 0,
      "y": 0,
      "w": 20,
      "h": 3
    },
    {
      "id": "dark",
      "tag": "checkbox",
      "x": 0,
      "y": 0,
      "w": 20,
      "h": 1,
      "text": "Dark mode",
      "focused": true,
      "checked": true
    },
    {
      "id": "beta",
      "tag": "checkbox",
      "x": 0,
      "y": 1,
      "w": 20,
      "h": 1,
      "text": "Beta"
    }
  ],
  "grid": [
    "[x] Dark mode       ",
    "[ ] Beta            ",
    "                    "
  ]
}
